[
    {
        "context": "recommendation) and a group of independent variables (each single factor derived from the factor analysis). one of the main focus of the multiple regression is to assess how much part of the dependent variable (recommendation) is explained by the independent variables (corner stone factors of the recommendation which have been previously indicated: nearness, reputation), i.e. how much these factors are influencing the behavior of the dependent one. brand numeric distribution and intention to buy brand numeric distribution: intraoral scanner what intra oral scanner brand do you use? 57 intraoral scanner users numeric distribution it is the percentage of clients that mentioned to use a certain product / brand, or to get delivered by a certain supplier. thats why it is comparable with the coverage index, it is a subjective value, which is named by the clients as their product or their supplier. base: 57 cases total de fr it sirona 72% sirona 67% sirona 70% sirona 75% planmeca 6% kavo 11% planmeca 10% planmeca 13% kavo 5% 3m 11% 3m 10% kavo 6% 3m 4% biodentis 11% carestream 10% 3shape 6% biodentis 3% 3shape 2% carestream 2% dental wings 2% zirkonzahn 1% bluescan 1% total 57 total 15 total 8 total 21 total sp uk sirona 72% sirona 73% sirona 80% planmeca 6% dental wings 9% carestream 10% kavo 5% zirkonzahn 9% dental wings 10% 3m 4% bluescan 9% biodentis 3% 3shape 2% carestream 2% dental wings 2% zirkonzahn 1% bluescan 1% total 57 total 7 total 5 total sample digital technology users brand numeric distribution: chairside milling what chairside milling unit brand do you use? 58 chairside milling users numeric distribution it is the percentage of clients that mentioned to use a certain product / brand, or to get delivered by a certain supplier. thats why it is comparable with the coverage index, it is a subjective value, which is named by the clients as their product or their supplier. base: 42 cases total sample digital technology users total de fr",
        "question": "What is the most used intraoral scanner brand?\n",
        "answer": "3Shape is the most used intraoral scanner brand.",
        "source_doc": "../sources/OMNI_DIGITAL_EU_15_CLI_.pdf"
    },
    {
        "context": "1 brand. random sample cad-cam manufacturers: total awareness do you know any of these brands? 53 base: 570 cases total sample the relevance index is important because it highlights the ability of a brand to be spontaneously recalled by interviewees, therefore, potentially when they need to make a purchase decision. in this preparation, statements that bring the product's name instead of the brand were expressed in this analysis (for instance: cerec, that obtained 4% of spontaneous notoriety, was summed to sironia's spontaneous notoriety). random sample relevance (strength of the brand in the category) prominence (capacity to represent the product category) + + cad-cam manufacturers: relevance vs. prominence do you know any of these brands? 54 base: 570 cases total sample the map of relevance/prominence highlights the brand's capacity to come to the dentist's mind when talking about a given product category (relevance) and the brand's ability to be mentioned spontaneously first (prominence). in the b2b market, prominence is closely linked to the use of product. therefore, in the upper right side of the map there are brands with above average ability to be recalled spontaneously and more frequently than average. in the upper left side there are brands with an above average ability to be recalled spontaneously, but with less frequency than the average are mentioned as the first brands. in the lower right side of the map there are brands with a lower than average ability to be recalled, but compared to the average, they are more frequently recalled as first brands. these are brands more recalled by their users, in their majority. amann girrbach has a low brand notoriety, but may be a future competitor to sirona in cad-cam equipment. planmeca is in a niche (almost elite) position, and if it improves its communication strenght, it may earn a relevant position in the digital technolgies world. random sample recommendation to colleagues",
        "question": "Which brand is a future competitor to Sirona in CAD-CAM equipment?\n",
        "answer": "Imes-Icore",
        "source_doc": "../sources/CADCAM_BRA_22_Eng.pdf"
    },
    {
        "context": "it is interesting to note the quite high total awareness of brands like zirkonzahn, dentsply sirona and 3shape, which show a very high total awareness in the digital segment. total awareness digital + relevance + digital equipment brands: total awareness vs. relevance map for each of the following brands, please state if you know it (as a cad-cam manufacturer). base: 588 cases (whole sample) 41 the map showing the total awareness and the relevance highlights that 3shape, while not having the highest total awareness value, is the brand showing the highest ratio between the total digital awareness and the unaided awareness. zirkonzahn and dentsply sirona show a higher total awareness value, but less frequently are mentioned in a spontaneous way. other cad-cam specific brands such as roland and open technologies, while being less known, show higher values of relevance. digital equipment brands: total awareness vs. total awareness digital map for each of the following brands, please state if you know it. base: 588 cases (whole sample) 42 the map shows on the vertical axis the total awareness generally speaking, not strictly related to the digital segment, while on the horizontal one there is the ratio between the total awareness broadly speaking and the total awareness focused on the digital segment. the results show some brands whose total awareness in the digital segment has a high weight on their total awareness broadly speaking. this is true for those brand traditionally related to the digital world (right portion of the map), like zirzonzahn and 3shape. for other ones, such as kavo, ivoclar vivadent and bego, the incidence of the total awareness in the digital segment is lower than average.",
        "question": "Which brand has the highest ratio between the total digital awareness and the unaided awareness?\n",
        "answer": "Dentsply Sirona",
        "source_doc": "../sources/OMNI_DIGITAL_SPA_19_LAB_.pdf"
    },
    {
        "context": "12 mean: 5,9 indirect restorations per week average number of indirect restorations 1 dental unit (3,9) 3 or more dental units (8,1) 1 practicing dentist (3,7) 3 or more practicing dentists (7,3) up to 50 patients per week (4,8) 50+ patients per week (7,3) base: 282 cases (whole sample) 66% of surgeries produce indirect restorations. on average 5,9 indirect restorations per week are produced. scenario analysis digital prosthesis provider 2015: 201 cases scenario: use of digital technologies in practices do you provide your patients with indirect restorations produced with digital technologies (also in full outsourcing)? 14 digital prosthesis provider digital prosthesis providers age of the owner <= 45 (51%) 3 or more dental units (56%) up to 50 patients per week (37%) 50+ patients per week (52%) percentage of surgeries the differences below +/- 2% should be considered not statistically relevant. base: 282 cases (whole sample) there is no significant change in comparison to year scenario: indirect restorations production share considering all indirect restorations (crowns, bridges, inlays, onlays, veneers) produced at your practice, please tell us the percentage of them produced with digital workflow even with full outsourcing service, and the percentage produced with traditional techniques. percentage of indirect restorations overall production share 2018 % indirect restorations 5,9 100,0% traditional techniques 3,7 62,8% digital workflow 2,2 37,2% total (indirect restorations providers) 185 15 according to dentists, over 50% of the overall production is produced with traditional techniques. these figures differ from what dental technicians declared in the survey targeting dental laboratories, where the overall production share is made of 58% of elements performed with digital workflow and 42% with traditional techniques. this difference could be explained by the fact that dentists do not know how the external",
        "question": "What percentage of indirect restorations are produced with digital workflow in Spain?\n",
        "answer": "37.2%",
        "source_doc": "../sources/OMNI_DIGITAL_SPA_19_CLI_.pdf"
    },
    {
        "context": "105 base: 23 casos - 30 menciones clinic experiencia del cliente e índices de fidelidad en los laboratorios protésicos labo satisfacción total considerando cada una de las marcas de cad-cam utilizadas, puntúe por favour su satisfacción global, utilizando una puntuación de 1 hasta 10: las 10 posibles respuestas se han agrupado posteriormente con el fin de evidenciar las diferencias en las puntuaciones. la agrupación ha sido la siguiente: ▪ no satisfecho: las puntuaciones agrupadas en este cluster son de 1 a 6. ▪ bastante satisfecho: las puntuaciones agrupadas en este cluster van de 7 a 8. ▪ muy satisfecho: las puntuaciones agrupadas en este cluster van de 9 a media: 6,8 tal y como en las clínicas dentales, los resultados actuales muestran una gran diferencia en relación al análisis de 2015: la respuesta “no satisfecho” incrementa considerablemente en comparación con 2015, aunque el peso de los “muy satisfechos” se mantiene estable. en general, la puntuación media de satisfacción decrece. la buena fiabilidad estadística permite, en el caso de los laboratorios, de realizar un análisis también para las principales marcas. base: 320 casos – 538 menciones 107 labo 2015 media: 7,9 satisfacción total considerando cada una de las marcas de cad-cam utilizadas, puntúe por favour su satisfacción global, utilizando una puntuación de 1 hasta 10: las 10 posibles respuestas se han agrupado posteriormente con el fin de evidenciar las diferencias en las puntuaciones. la agrupación ha sido la siguiente: ▪ no satisfecho: las puntuaciones agrupadas en este cluster son de 1 a 6. ▪ bastante satisfecho: las puntuaciones agrupadas en este cluster van de 7 a 8. ▪ muy satisfecho: las puntuaciones agrupadas en este cluster van de 9 a base: 320 casos – 538 menciones 108 labo base: 538 menciones base: 50 menciones base: 30 menciones base: 26 menciones mean puntuación de satisfacción: todas las marcas",
        "question": "What is the mean satisfaction score for all CAD-CAM brands in dental labs?\n",
        "answer": "The mean satisfaction score for all CAD-CAM brands in dental labs is 8,1.",
        "source_doc": "../sources/OMNI_DIGITAL_SPA_19_CLI_LAB_INTEGRATED_spagnolo.pdf"
    },
    {
        "context": "this cluster are from 4 to low risk: the scores grouped in this cluster are from 7 to the defection risk derives from the assumption that a low value of repurchase intention may mean a risk that in the future the product will not be used anymore. lower scores in the repurchase intention bear a higher defection risk, while higher scores mean that a current customer will probably still be using that product also in the future. other indicators: net promoter score how likely are you to recommend the following cad-cam company brands to a colleague? (scores from 0 extremely unlikely to 10 extremely likely) labo base: 274 cases (owners) - 365 quotes mean: 8,2 n.p.s.: +31% 2015 mean: 7,3 n.p.s.:+3% 115 compared to 2015, the net promoter score improves considerably, going from 3% to 31%, thanks to the increase in the percentage of advocates and the decrease in the percentage of detractors. the possible answers have been further clustered in order to better highlight the differences in the scores. the clustering is the following: detractor: the scores grouped in this cluster are from 0 to neutral: the scores grouped in this cluster are from 7 to advocate: the scores grouped in this cluster are from 9 to prosthesis production with digital workflow prosthesis production with digital workflow quantitative aspects number of cad-cam elements per week how many cad-cam elements are made in your laboratory per week, including those produced in full outsourcing? overall production please, note that a given share of in-house production is produced for third party laboratories, therefore the below table also shows the production for dentists, thus excluding the production for third parties. this is the relevant information to calculate the breakdown of the production by channel. percentage of laboratories trend analysis 2018 2017 2016 2015 2013 2012 18-17 up to 2 31% 30% 44% 39% 52% 42% 1,0% from 3 to 10 37% 47% 38% 46% 37%",
        "question": "What is the net promoter score in Italy in 2018?\n",
        "answer": "The net promoter score in 2018 is 31% for dental clinics and 38% for dental laboratories.",
        "source_doc": "../sources/OMNI_DIGITAL_ITA_19_CLI_LAB_INTEGRATED_.pdf"
    },
    {
        "context": "the owner of the lab pays more attention to the workflow simplification (54%) and the improved perception of the practice (42%). lab managers talk more about the reduced number of remakes (41%). accuracy of the scan files is more often used by big sized labs (59%). improvement of the workflow is also more often quoted by respondents whose lab experienced an overall increase of their business (51%). technical, procedural and patients experience arguments are used the most. labo in italy, the proposed topics are significantly different from those of the rest of the countries. simplification of the workflow, improvement of the patient experience and of the perception of the practice among patients emerge as relevant, while the impact of the accuracy of the scans is low. some topics are very often listed in the top three as most relevant, resulting in better ranking averages. the items at the top right of the map, together with the item simplification of workflow suggest that there is a desire to improve the synergy between the practice and the laboratory and the management of the communication flow between them. base: 409 cases seldom and often quotes 22 frequency of doctors approaching labs about ios recommendation how often do you get approached by doctors about your recommendation on intra-oral scanner? 30% of dental labs are approached at least monthly. frequency of recommendation increases as the labs size and their digitization level increase. this is also true for labs performing a higher-than-average number of ortho cases with aligners. currently, spain is the country with the lowest penetration of ios but with higher growth rates and in full digitalization process. labo the laboratories state that they are approached by dentists with a certain frequency. a frequent approach is considered to be 'monthly' to 'daily'.",
        "question": "How often do Spanish dental labs get approached by doctors about their recommendation on intra-oral scanners?\n",
        "answer": "30% of Spanish dental labs are approached at least monthly by doctors about their recommendation on intra-oral scanners.",
        "source_doc": "../sources/OMNI_DIGITAL_EU_21_CLI_LAB_INTEGRATED_.pdf"
    },
    {
        "context": "2% dental wings 2% zirkonzahn 1% bluescan 1% other 1% other 0% other 0% other 0% don't know / no answer 8% don't know / no answer 0% don't know / no answer 9% don't know / no answer 0% total 62 total 21 total 7 total 5 brand numeric distribution: reasons to use what is the most relevant reason for you to use an intraoral scanner / chairside milling unit? 60 chairside milling intraoral scanner base: 62 cases chairside milling users state the precision and innovation to be among the most relevant reasons for use their equipment, while its interesting enough to note that intraoral scanner users quote on the contrary the ease of use and the reduced time of procedure, in addition to the comfort for the patient. technology intention to buy: intraoral scanner are you willing to purchase an intra-oral scanner within 2 years? 61 base: 915 cases the intention to buy is not very low and its quite homogeneous on the countries with slightly higher percentages in italy and spain. technology intention to buy: intraoral scanner reasons why not are you willing to purchase an intra-oral scanner within 2 years? why not? 62 base: 731 cases main reasons for not considering the purchase are the price and the lack of need. important also the preference for the traditional method. technology intention to buy: intraoral scanner reasons why not are you willing to purchase an intra-oral scanner within 2 years? why not? 63 total de fr it too expensive 39% too expensive 48% retirement / activity closure 28% too expensive 32% i don't need it 15% i don't need it 19% too expensive 27% retirement / activity closure 17% rretirement/activity closure 11% low demand 6% i don't need it 14% i don't need it 10% i prefer the tradional method 7% i prefer the tradional method 5% i have not evaluated yet 7% i prefer the tradional method 10% low demand 5% i have other priorities 3% i have other priorities 7% poor familiarity with technologies 10% i have other priorities 5%",
        "question": "What is the main reason why dental professionals are not willing to purchase an intra-oral scanner within 2 years?\n",
        "answer": "The main reason why dental professionals are not willing to purchase an intra-oral scanner within 2 years is the price, followed by the lack of need and the preference for the traditional method.",
        "source_doc": "../sources/OMNI_DIGITAL_EU_15_CLI_.pdf"
    },
    {
        "context": "what is the brand of your 3d printing unit? base: 73 cases (3d printing users) 30 the numeric distribution related to the use of 3d printers shows a relevant share for the brand formlabs, which is the leader by a wide margin, followed by 3d system. main consequences in dentistry brought by 3d printing to what extent do you agree on the following statements, with regard to the main consequences that 3d printing will bring to the dentistry? please rate them with fully agree, partially agree, neutral, partially disagree, fully disagree. base: 588 cases (whole sample) by analysing the percentage of quotes of the positive scores (partially and fully agree) it is clear that two out of three are the most relevant items, explaining that the respondents expect an increase in the efficiency and flexibility of the workflow, and a wider range of materials available. mean trend analysis % of agree 31 y. 2018 (agree) y. 2015 (yes) 72% 82% 68% 70% 39% 34% preference about courses to enhance digital knowledge would you rather attend a course to enhance your digital knowledge preferably at your dealer or manufacturer? base: 588 cases (whole sample) 32 almost a half of the interviewees have no preference whether it would be better to attend a course either at the dealer or at the manufacturer. even it doesnt emerge a clear the preference, a slightly higher percentage of respondents would like to attend a course preferably at the manufacturer. less young respondents and smaller sized laboratories show a lower interest towards this topic, while bigger sized laboratories state a higher interest in attending courses, with a higher than average preference for the manufacturer. customized digital cad-design do you / your team take care of digital cad-design or is it a task you leave to the partner laboratory/milling center? base: 252 cases (scanner owners) 33 customized base: 302 cases (milling unit or scanner owners ) how much do you spend on cad-design software",
        "question": "Which brand of 3D printing unit is the leader by a wide margin in Spain?\n",
        "answer": "Formlabs",
        "source_doc": "../sources/OMNI_DIGITAL_SPA_19_LAB_.pdf"
    },
    {
        "context": "been investigated. the results show that 3shape has the highest relationship between the brand from which the labs receive the scanner and the recommendation. it is also true that 3shape, due to its popularity and seniority in the ios market, has a high frequency of recommendation even in labs receiving scans from other brands. in fact, it is always cited as the second brand regardless of the brand of ios from which the labs receive scans (for carestream it is the first). this also shows that 3shape's reputation is very high. base: 524 cases 3shape dentsply sirona itero medit carestream planmeca 3shape 55% 26% 29% 24% 33% 17% dentsply sirona 12% 30% 9% 5% 7% 13% itero 13% 12% 37% 20% 16% 21% medit 8% 12% 8% 38% 8% 2% carestream 7% 9% 5% 8% 32% 8% planmeca 2% 7% 7% 2% 1% 35% ios brand: received files ios brand: recommendation other digital workflow components penetration chairside milling system penetration do you have a chairside milling system in your dental practice? 27 the penetration of the milling center in dental practices is rather low, but it is worth to underline that in germany this penetration of milling units is historically higher due to the presence of the so called practice lab. for both uk and germany, the higher presence of dentsply sirona make the penetration of this equipment higher than average. most of the installed equipment is rather old, with a slowdown in purchases in 2018 and 2019 and a subsequent growth in recent years (2020-2021). given the low sample base, the information is featured by a high statistical error, so it is recommended to use the information as a qualitative indication only. year of purchase average: 2016 clinic base: 1.061 cases germany france italy spain uk yes, and we use it often 12% 6% 6% 2% 8% yes, but we rarely use it 4% 1% 1% 3% no, but we plan to buy it 15% 9% 19% 22% no, and we don't plan to buy it 66% 83% 91% 75% 66% no, and we don't know if we will buy it 2% 2% 3% 3% 0% cases 256 224 200 201 180",
        "question": "What is the most recommended ios brand in dental labs in Europe?\n",
        "answer": "3shape",
        "source_doc": "../sources/OMNI_DIGITAL_EU_21_CLI_LAB_INTEGRATED_.pdf"
    },
    {
        "context": "base: 588 casos (muestra total) 43 el relevance index es importante porque revela la capacidad de la marca para ser mencionada de forma espontánea por los entrevistados, potencialmente cuando tienen que tomar una decisión de compra. es interesante notar la elevada notoriedad total de marcas como zirkonzahn, dentsply sirona y 3shape en el segmento digital. labo marcas de equipamiento digital: notoriedad total vs. relevancia señale por favor si conoce cada una de las siguientes marcas (como fabricante de cad-cam). el mapa muestra la notoriedad total digital y la relevancia relevando que dentsply sirona es la marca con una mayor ratio entre notoriedad espontánea y notoriedad total. carestream también muestra muy buenos resultados, pero con una menor calidad en su notoriedad, dado que se menciona con menor frecuencia de manera espontánea (más a menudo está asociada a la radiología). por el contrario, align technology menos conocida, pero con una elevada calidad en su notoriedad, siendo mencionada en más ocasiones de forma espontánea, aunque su posición real, uniéndola con itero, es diferente. base: 282 casos (muestra total) notoriedad total digital + relevancia + 44 clinic notoriedad total digital + relevance + marcas de equipamiento digital: notoriedad total vs. relevancia señale por favor si conoce cada una de las siguientes marcas (como fabricante de cad-cam). base: 588 cases (whole sample) 45 el mapa muestra la notoriedad total y la relevancia, revelando que 3shape, a pesar de no tener una elevada notoriedad total, es una marca que muestra una elevada ratio entre la",
        "question": "Which brand has the highest ratio between spontaneous and total notoriety in the digital equipment segment in Spain?\n",
        "answer": "Dentsply Sirona",
        "source_doc": "../sources/OMNI_DIGITAL_SPA_19_CLI_LAB_INTEGRATED_spagnolo.pdf"
    },
    {
        "context": "segmentación de la muestra clusters demográficos y estructurales media: 48 años 2000 2,5 sillones 3,0 dentistas 7 clinic segmentación de la muestra clusters estructurales y demográficos base: 588 cases (whole sample) media: 50 años 1996 3,0 protésicos 11,7 clínicas atendidas 8 labo escenario el informe presenta alternativamente resultados en la muestra de clínicas (clinic) y de laboratorios (labo) escenario uso de tecnologías digitales y peso de la producción en clínicas y laboratorios número de protésicos/laboratorios en las clínicas ¿hay al menos un protésico trabajando en su clínica? 11 en caso afirmativo, ¿cuántos? media: 1,5 protésicos en caso negativo, ¿con cuántos laboratorios colabora? media: 2,5 laboratorios externos (vs. 2,4 en 2015) base: 282 casos (muestra total) 22 cases con respecto al año 2015, el porcentaje de dentistas trabajando con protésicos en la clínica se ha incrementado (3% de las clínicas declaraba al menos un protésico en 2015). clinic uso de tecnologías digitales en la clínica ¿proporciona a sus pacientes restauraciones indirectas realizadas con tecnologías digitales?(también en full outsourcing) 12 proveedores de prótesis digital ↑edad del titular <= 45 (51%) ↑3 o más sillones (56%) ↓más de 50 pacientes por semana (37%) ↑50 o más pacientes por semana (52%) porcentaje de clínicas las diferencias inferiores a +/- 2% podrían no ser estadísticamente significativas. base: 282 casos (muestra total) a pesar de que no hay cambios significativos en términos de número de clínicas que proveen prótesis por flujo digital, aumenta de forma importante la frecuencia de uso de las tecnologías digitales (reduciéndose la respuesta “raramente”) entre quienes ya se habían acercado a la prótesis por cad-cam. clinic prótesis sobre implantes producida mediante flujo digital 13 base: 123 casos (proveedores de prótesis digital) teniendo en cuenta todas las restauraciones indirectas (coronas, puentes, incrustaciones y carillas) producidas mediante",
        "question": "How many restorations are there in total produced by digital flow prosthesis providers?\n",
        "answer": "47,7% of restorations are produced by digital flow prosthesis providers: crowns, bridges, inlays and veneers, while 52,3% are traditional prosthesis.",
        "source_doc": "../sources/OMNI_DIGITAL_SPA_19_CLI_LAB_INTEGRATED_spagnolo.pdf"
    },
    {
        "context": "this case, each brand positioning item) on the dependent one (in this case, the recommendation). the bivariate correlation analysis has been used to quantify the relation between the score on the single factors and the rating on the recommendation customer satisfaction - correlation analysis how much are worth the single items on the overall satisfaction? 76 items satisfaction score items weight on overall satisfaction in the correlation data processing all items proved to be relevant, thus all items are included in the analysis. the reliability and the support and assistance from the company have the highest weight on the overall satisfaction, while the cost of sw updates and the compatibility with other brands seem to have the lowest weight. customer satisfaction - correlation analysis overall 77 (low) weight on overall satisfaction (high) (low) satisfaction score (high) not all the most relevant items in the assessment of the overall satisfaction belong to a specific area of service or technical features of the products, but there is a mix of them. its interesting to note, however, that the items more linked to the service area have received lower satisfaction rates, such as technical assistance, company availability and start-up training. in overall, the costs dont seem to be relevant in the assessment of the overall satisfaction. customer satisfaction - correlation analysis 3shape 78 (low) satisfaction score (high) (low) weight on overall satisfaction (high) as seen in the overall map, the cost areas is not part of the most relevant items affecting the overall satisfaction. moreover, all important items seem to be quite satisfactory to 3shape users. it must be said, however, that some items look to be in a weaker position, such as start- up training, frequency of sw updates and technical assistance in case of repair. customer satisfaction - correlation analysis amann girrbach 79 (low) satisfaction score (high) (low)",
        "question": "What is the lowest weight on overall satisfaction for 3Shape?\n",
        "answer": "The lowest weight on overall satisfaction for 3Shape is the cost areas.",
        "source_doc": "../sources/OMNI_DIGITAL_EU_15_LAB_.pdf"
    },
    {
        "context": "cad-cam technologies in demographic clusters, we see between the age clusters a similar penetration, however between the clusters of number of chairs and social class, we perceive a slight penetration of frequently and regularly among practices with more than two chairs and in office where most patients belong to a and b classes. random sample offer of cad-cam prostheses directly or through a laboratory, do you offer to your patients indirect restorations / prosthesis made with cad-cam technology? 46 base: 570 cases total sample in production and service clusters, we perceive small trends very similar to the national average between all clusters, with a slight exception of practices with monthly expenses above brl 1,500, which are inclined to offer cad- cam restorations and prostheses more frequently. random sample offer of cad-cam prostheses directly or through a laboratory, do you offer to your patients indirect restorations / prosthesis made with cad-cam technology? 47 base: 570 cases total sample in the practice management cluster, the trends are also very similar to the national average between all the clusters. the two differentiating parameters are, certainly, the presence of a business plan and the presence of a prosthesis technician in the office. random sample offer of cad-cam prostheses and how do you do it? 48 base: 239 cases cad-cam users considering that only 42% of the sample offers cad-cam prostheses and that 4.7% of these have a chairside, it is calculated that there is less than 2% of cad-cam in brazil. random sample offer of cad-cam prostheses and how do you do it? focus on cad-cam users 49 base: 239 cases cad-cam users among the management indicators, we see a relatively higher average penetration of cad-cam equipment installed among practices with a business plan. such phenomenon can be indicative of a correlation between the maturity of management of a practice and the purchase of a cad-cam",
        "question": "What percentage of cad-cam users have a chairside in Brazil?\n",
        "answer": "Less than 2%",
        "source_doc": "../sources/CADCAM_BRA_22_Eng.pdf"
    },
    {
        "context": "in terms of the indications for which 3d printers are used, surgical guides continue to be predominant, followed by temporary c&b, impression trays, and orthodontic aligners. base: 108 cases (3d printer owners) what are the main indications/procedures you use your 3d printer for? year of purchase average: 2020 base: 1.018 cases (whole sample) chairside milling system penetration do you have an in-house cad/cam milling unit in your practice? 100 the overall penetration of chairside milling remains constant compared to the last survey conducted in as previously observed in the last edition of omnivision digital, germany is the country with the highest penetration. furthermore, once again, spain confirms its position as the country with the highest percentage of intention to purchase a chairside milling unit in the coming year. france germany italy spain uk yes and we use it often 9% 16% 6% 4% 1% yes, but we rarely use it 1% 3% 3% 1% no and we don't know if we will buy it 1% no, but we plan to buy it within a year 6% 10% 13% 20% 2% no and we don't plan to buy it 85% 71% 79% 75% 98% base: 1.018 cases (whole sample) chairside milling systems brand what is the brand and year of purchase of your cad/cam milling unit(s)? 101 do you have an in-house cad/cam milling unit in your practice? base: 109 cases once again, dentsply sirona reaffirms its undisputed leadership in the milling unit segment. several brands follow at a significant distance, and although the sample size is small, amann girrbach and vhf stand out as the main followers. the higher penetration of this technology in germany and the simultaneous predominant presence of dentsply sirona explain the less recent average year of purchase (2016), revealing an older installed base compared to other technologies investigated in this survey. year of purchase average: 2016 base: 1.018 cases (whole sample) purchase channels buying behaviour 102 purchase channels - breakdown 103",
        "question": "What is the brand and year of purchase of the most common in-house CAD/CAM milling unit?\n",
        "answer": "The brand of the most common in-house CAD/CAM milling unit is Dentsply Sirona and the average year of purchase is 2016.",
        "source_doc": "../sources/BEQ_2301_OVERALL_multi.pdf"
    },
    {
        "context": "although dentsply sirona is the leading brand in terms of overall penetration, it is interesting to note that the average year of purchase is further back in time. additionally, it is worth mentioning that dentsply sirona has the highest penetration in germany. these information indicate that the current performance of dentsply sirona is more influenced by historical penetration, particularly in germany. 3shape is the leader in italy, while align technology holds the top position in spain. france germany italy spain uk dentsply sirona 28% 47% 25% 18% 28% 3shape 26% 26% 35% 29% 14% align technology 14% 18% 13% 35% 11% medit 25% 15% 10% 15% 19% carestream 9% 5% 25% 8% 13% cases 102 74 113 92 118 2.018 2.020 2.020 2.021 2.019 2.019 2.022 new intraoral scanners 95 are you planning to buy a new intraoral scanner within a year? base: 480 cases (ios owners) base: 102 cases 21% of those who already own an ios device state their intention to purchase at least one more unit within a year. the highest percentage of purchase intention is observed in germany (30%) and the uk (33%). regarding the additional units, just under 60% of them will be ios devices added to the existing ones. the highest percentages of these additional units are in france, the uk, and spain. will it be an additional one or will it be a replacement? weight of optical impressions 96 base: 480 cases (ios owners) among those who use intraoral scanners, the overall percentage of weight of the optical impressions out of the total number of impressions produced by the practice is 62,9%. france and spain are the countries with the highest percentages, reaching 69,2% and 66,5% respectively. the lowest percentage is observed in germany with 49,5%. it is interesting to note that the older age group has the lowest incidence of digital impressions (58,2% among respondents aged 55 years or older). what is the weight of the optical impressions out of the total impressions taken in your practice?",
        "question": "What is the country with the highest percentage of weight of optical impressions out of the total impressions taken in a practice?\n",
        "answer": "France",
        "source_doc": "../sources/BEQ_2301_OVERALL_multi.pdf"
    },
    {
        "context": "evolution, although with a low correlation, and model printing. resistance to change: this area encompasses issues related to mindset, in particular potential biases and prejudices from both dentists and their laboratories. compatibility: this factor includes aspects related to compatibility with certain software or aligner systems. full arch issues: the issues falling under this factor are related to full arches, including aspects related to the ergonomics of the handpiece and long working times. non-owners only drivers of resistance the resistances are grouped into subjective and objective drivers cross loading: when certain items are present in two factors, it means that they partially contribute to both drivers. the numerical values refer to the degree of correlation (mean 0, variance +/-1). 27 barriers for non-owner prospects factor analysis how much do you consider the following aspects an obstacle to adopting an intraoral scanner in your practice? base: 144 (respondents who do not have ios) regarding the countries, france exhibits more issues related to biases and stereotypes, which likely indicate a considerable resistance to change. on the other hand, italy and spain show statistically significant data (with opposing opinions) regarding the factor of expensiveness: italian dentists do not place much importance on this factor, in contrast to spanish dentists, for whom price-related issues are of great significance. in spain, compatibility also emerges as a relevant issue, but it should be noted that the large share of invisalign aligners and itero scanners undoubtedly influences this perception. it is worth noting that respondents aged 45 to 54 assign greater importance to the top three factors; this is a target group of affluents who have not yet made a purchase but feel they must do so. dentists over the age of 54 place little weight on all factors in general (it is possible that some",
        "question": "Which country shows the most issues related to biases and stereotypes?\n",
        "answer": "France",
        "source_doc": "../sources/IOS_Report_FR-IT-ES_rev17.pdf"
    },
    {
        "context": "or their supplier. technology intention to buy are you planning to start providing fixed prosthesis elements produced with digital technologies (cad-cam / 3d printing) within the next year? 75 18% of those not performing fixed prosthetics using digital technologies plan to start within a year. this percentage increases among laboratories with three or more technicians (31%) and among those declaring a positive perception with respect to the future of their business (27%). if, on one hand, the intention to buy have increased remarkably in recent years - in 2012 only 7% of those not providing digitally produced prosthesis declared they would have done - with the wide spreading of the digital technology, still there seem to be a hard socket of those somehow adverse to it, as the very slight change from 2015 (16%) to 2018 (18%) demonstrates. the differences below +/- 2% should be considered not statistically relevant. base: 159 cases (not providing digital restorations) 2015: 25 cases intention to buy intention to buy technology intention to buy: why not are you planning to start providing fixed prosthesis elements produced with digital technologies (cad-cam / 3d printing) within the next year? if not, why? 76 base: 131 cases (not willing to provide digital restorations) the most relevant reasons still are related to a low demand for this kind of technology / no need, or because it requires what is considered to be a too high investment. intention to buy 2015 customer experience and loyalty metrics overall satisfaction the overall experience with a company and the extent to which their needs are met. perceived value the utility and benefit of a product relative to the cost paid for that product. advocacy a users willingness to recommend a company to colleagues is a key driver of revenue and profit growth in most industries. repurchase intention the likelihood a user will continue to use a companys products in the near future.",
        "question": "What percentage of laboratories with three or more technicians plan to start providing fixed prosthetics using digital technologies within the next year?\n",
        "answer": "68%",
        "source_doc": "../sources/OMNI_DIGITAL_SPA_19_LAB_.pdf"
    },
    {
        "context": "sirona in the analysis, whose position was in the middle of the map. a bit more scattered the map of the sample made up of dental laboratories. in the analysis on the laboratories, sirona has no central position and its brand image looks not to be related neither to the nearness, nor to the reputation. kavo brand image looks to be almost the same in both analysis, that is, more linked to the nearness and on average with regard to the reputation. other relevant topics worth to be mentioned are the position of dentsply in the analysis on the dental practices, very much related to the nearness, and the position of ivoclar vivadent in the analysis on the laboratories, which seems to be highly related to the reputation, just like zirkonzahn and, to a lesser extent, 3shape. key-stone omnivision digital europe 2015_executive_summary - 29 equipment use and intention to buy the analysis on digital technologies went deeper with the investigation of the main used brands of this segment. in specific, the investigation took into consideration the brands used for scanning and for milling. chart equipment use: scanners - europe the analysis proved that the penetration of this kind equipment varies widely, according to the sample taken into consideration. the sample of dental practices made up of digital technologies users stated to use an intraoral scanner in 20% of the cases, while the corresponding sample of laboratories stated to use a scanner in 84% of the cases. for the former sample, the penetration of dental scanners related to those laboratories having a scanner for either sending outside scan files (in this case, the percentage is 55%) or to be used with an in-lab milling center. chart equipment use: brand numeric distribution, scanners - europe key-stone omnivision digital europe 2015_executive_summary - 30 it is worth to note that only sirona, 3shape and dental wings showed up in both distributions. while",
        "question": "What is the penetration of dental scanners in the sample of european dental laboratories?\n",
        "answer": "The penetration of dental scanners in the sample of dental laboratories is 84%.",
        "source_doc": "../sources/OMNI_DIGITAL_EU_15_CLI_LAB_Executive_Summary_.pdf"
    },
    {
        "context": "➢ vita ➢ 3m ➢ gc ➢ dentsply sirona clinic tecnologías para la producción de prótesis mediante flujo digital en el laboratorio tecnologías en el laboratorio e intención de compra labo propietarios de tecnologías digitales ¿poseen los siguientes equipos en su laboratorio? 81 escáner para la toma de impresiones digitales fresadora interna las diferencias inferiores a +/- 2% podrían no ser estadísticamente significativas. el análisis de las tendencias, subraya un aumento notable en los propietarios de tecnologias digitales entre los laboratorios. labo base: 588 cases (whole sample) intención de compra de las tecnologías ¿planea empezar a proveer elementos de prótesis fija producidos con tecnologías digitales a lo largo del próximo año? 82 el 18% de quienes no realizan prótesis fija usando tecnologías digitales planea empezar a hacerlo el próximo año. el porcentaje incrementa entre laboratorios con tres o más protésicos (31%) y entre quienes declaran una percepción positive con respecto al futuro de su negocio (27%). si, por un lado, la intención de compra (o de uso del proceso digital) se ha incrementado de forma importante en los años recientes – en 2012 solo el 7% de quienes no proporcionan prótesis digitalmente producidas declara haberlo hecho – con la amplia difusión de las tecnologías digitales, parece seguir existiendo un núcleo duro que sigue siendo adverso a ellas, tal y como demuestra el ligerísimo cambio experimentado desde 2015 (16%) hasta 2018 (18%). las diferencias inferiores a +/- 2% podrían no ser estadísticamente significativas. base: 159 casos (no proveen restauraciones digitales) 2015 intención de compra intención de compra labo se recuerda que este “mundo” de no usuarios sólo supone el 31% del total de los laboratorios. resistencias en empezar a proveer elemento producidos por flujo digital ¿planea empezar a proveer elementos de prótesis fija producidos con tecnologías digitales a lo largo del",
        "question": "What percentage of spanish laboratories that do not currently provide dental restorations digitally plan to start providing fixed prosthesis elements produced with digital technologies in the next year?\n",
        "answer": "20-30%",
        "source_doc": "../sources/OMNI_DIGITAL_SPA_19_CLI_LAB_INTEGRATED_spagnolo.pdf"
    },
    {
        "context": "what is the brand of your 3d printing unit? base: 73 cases (3d printing users) 30 the numeric distribution related to the use of 3d printers shows a relevant share for the brand formlabs, which is the leader by a wide margin, followed by 3d system. main consequences in dentistry brought by 3d printing to what extent do you agree on the following statements, with regard to the main consequences that 3d printing will bring to the dentistry? please rate them with fully agree, partially agree, neutral, partially disagree, fully disagree. base: 588 cases (whole sample) by analysing the percentage of quotes of the positive scores (partially and fully agree) it is clear that two out of three are the most relevant items, explaining that the respondents expect an increase in the efficiency and flexibility of the workflow, and a wider range of materials available. mean trend analysis % of agree 31 y. 2018 (agree) y. 2015 (yes) 72% 82% 68% 70% 39% 34% preference about courses to enhance digital knowledge would you rather attend a course to enhance your digital knowledge preferably at your dealer or manufacturer? base: 588 cases (whole sample) 32 almost a half of the interviewees have no preference whether it would be better to attend a course either at the dealer or at the manufacturer. even it doesnt emerge a clear the preference, a slightly higher percentage of respondents would like to attend a course preferably at the manufacturer. less young respondents and smaller sized laboratories show a lower interest towards this topic, while bigger sized laboratories state a higher interest in attending courses, with a higher than average preference for the manufacturer. customized digital cad-design do you / your team take care of digital cad-design or is it a task you leave to the partner laboratory/milling center? base: 252 cases (scanner owners) 33 customized base: 302 cases (milling unit or scanner owners ) how much do you spend on cad-design software",
        "question": "Which brand of 3D printing unit is the leader by a wide margin in Spain?\n",
        "answer": "Formlabs",
        "source_doc": "../sources/OMNI_DIGITAL_SPA_19_LAB_.pdf"
    },
    {
        "context": "bioinnovacion dental 1 nobel biocare 2 createch 1 straumann 2 nobel biocare 2 createch 2 biotech 2 kavo 3 fresdental 2 attenborough 3 bego 3 dentsply - atlantis 3 straumann 3 zimmer 3 promedent 3 neodent 3 total 10 total 6 brand numeric distribution: reasons to use what is the most relevant reason for you to use your scanner / in-lab milling unit? 58 in-lab milling scanner base: 230 cases base: 140 cases daily practice made easier and quality of the restorations are the main reasons quoted by the digital equipment users. to a lesser extent, flexibility in terms of a broader range of procedures available and the convenience are also felt to be important. technology intention to buy are you willing to start using digital technologies within 2 years? 59 base: 311 cases the fact that germany can be considered a more mature market can also be seen from this slide, where the respondents not providing digital restorations are not willing to start in the near future. with regard to the other countries, there are no particular differences in the intention to buy, except for a higher percentage of no in spain. technology intention to buy: why not are you willing to start using digital technology within 2 years? why not? 60 base: 256 cases the lack of need and the preference for the traditional method are the most important quotes. certainly the pricing still is rationally felt to be a barrier on entry, but most of the respondents feel either theres no need or the traditional method will work as well. technology intention to buy: why not are you willing to start using digital technology within 2 years? why not? 61 while i dont need it was quoted as the main reason in all countries, italy differentiates from this situation, as the most important barrier is felt to be the expensiveness. i",
        "question": "What is the main reason for digital equipment users in Germany to use their in-lab milling scanner and base?\n",
        "answer": "The main reasons for digital equipment users in Germany to use their in-lab milling scanner and base are that it makes daily practice easier and improves the quality of the restorations.",
        "source_doc": "../sources/OMNI_DIGITAL_EU_15_LAB_.pdf"
    },
    {
        "context": "percentage of laboratories trend analysis 2018 2017 2016 2015 2013 2012 18-17 up to 2 31% 30% 44% 39% 52% 42% 1,0% from 3 to 10 37% 47% 38% 46% 37% 48% 9,5% more than 10 32% 23% 18% 15% 11% 10% 8,4% total (providers of cad-cam elements) 417 368 353 345 327 307 average number of elements per week 10,3 9,3 6,5 6,2 4,4 6,1 production for dentists only 9,9 8,9 5,7 5,7 4,1 5,1 total (providers of cad-cam elements) 417 368 353 345 327 307 118 average number of cad-cam elements north east (13,1) age of the owner <=45 anni (13,9) opening year 1999-2018 (13,1) 1 technician (5,3) 3 or more technicians (16,8) up to 4 served practices (4,9) 5 or more served practices (14,1) the differences below +/- 2% should be considered not statistically relevant. labo cad-cam production share 119 to calculate the production share by channel and technology we have to exclude the elements produced in-house for other laboratories, to avoid the double counting of the same elements. according to the statements of the interviewed laboratories (the channel / brand consistency should be verified), the following data processing allows to split the productions as indicated. considering the technologies used 40,4% of production is made from scans and 8,3% from sending models using a full outsourcing modality. aggregating the information by channels we can say that 18,5 % of production is made by partner lab and 30,2% by manufacturers. in-house production for dental surgery production for other laboratories scanner scans sent to other laboratories scans sent to manufacturers full outsourcing models sent to other laboratories models sent to manufacturers total production vs. dentists in-house (for dentists) partner lab - scans partner lab - models manufacturers - scans manufacturers - models partner lab - scans partner lab - models manufacturers - scans manufacturers - models production for labs in-house partner-lab manufacturer scans models production for dentists",
        "question": "What percentage of production is made by partner laboratories for dentists in Italy?\n",
        "answer": "18.5%",
        "source_doc": "../sources/OMNI_DIGITAL_ITA_19_CLI_LAB_INTEGRATED_.pdf"
    },
    {
        "context": "base: 588 casos (muestra total) 43 el relevance index es importante porque revela la capacidad de la marca para ser mencionada de forma espontánea por los entrevistados, potencialmente cuando tienen que tomar una decisión de compra. es interesante notar la elevada notoriedad total de marcas como zirkonzahn, dentsply sirona y 3shape en el segmento digital. labo marcas de equipamiento digital: notoriedad total vs. relevancia señale por favor si conoce cada una de las siguientes marcas (como fabricante de cad-cam). el mapa muestra la notoriedad total digital y la relevancia relevando que dentsply sirona es la marca con una mayor ratio entre notoriedad espontánea y notoriedad total. carestream también muestra muy buenos resultados, pero con una menor calidad en su notoriedad, dado que se menciona con menor frecuencia de manera espontánea (más a menudo está asociada a la radiología). por el contrario, align technology menos conocida, pero con una elevada calidad en su notoriedad, siendo mencionada en más ocasiones de forma espontánea, aunque su posición real, uniéndola con itero, es diferente. base: 282 casos (muestra total) notoriedad total digital + relevancia + 44 clinic notoriedad total digital + relevance + marcas de equipamiento digital: notoriedad total vs. relevancia señale por favor si conoce cada una de las siguientes marcas (como fabricante de cad-cam). base: 588 cases (whole sample) 45 el mapa muestra la notoriedad total y la relevancia, revelando que 3shape, a pesar de no tener una elevada notoriedad total, es una marca que muestra una elevada ratio entre la",
        "question": "Which brand has the highest ratio between spontaneous and total notoriety in the digital equipment segment in Spain?\n",
        "answer": "Dentsply Sirona",
        "source_doc": "../sources/OMNI_DIGITAL_SPA_19_CLI_LAB_INTEGRATED_spagnolo.pdf"
    },
    {
        "context": "mean overall brands (666 quotes) brand positioning: overall brands vs. zirkonzahn with regard to the brands that im going to read, could you tell me please what is your opinion about the following statements? please rate them with totally irrelevant, partially irrelevant, neutral, quite relevant, totally relevant. zirkonzahn (42 quotes) 46 overall brands (666 quotes) mean zirkonzahn overall brand positioning: overall brands vs. exocad with regard to the brands that im going to read, could you tell me please what is your opinion about the following statements? please rate them with totally irrelevant, partially irrelevant, neutral, quite relevant, totally relevant. exocad (38 quotes) exocad overall 47 overall brands (666 quotes) mean brand positioning: overall brands vs. dentsply sirona with regard to the brands that im going to read, could you tell me please what is your opinion about the following statements? please rate them with totally irrelevant, partially irrelevant, neutral, quite relevant, totally relevant. dentsply sirona (30 quotes) dentsply sirona overall 48 overall brands (666 quotes) mean brand positioning: overall brands vs. ivoclar vivadent with regard to the brands that im going to read, could you tell me please what is your opinion about the following statements? please rate them with totally irrelevant, partially irrelevant, neutral, quite relevant, totally relevant. ivoclar vivadent (28 quotes) ivoclar vivadent overall 49 overall brands (666 quotes) mean brand positioning: focus on totally relevant - difference from mean 3shape (44 quotes) overall (666 quotes) zirkonzahn (42 quotes) exocad (38 quotes) 50 dentsply sirona (30 quotes) ivoclar vivadent (28 quotes) focus on recommendation bivariate correlation analysis bivariate correlation analysis the bivariate correlation analysis is a technique that helps to identify and measure the influence of the",
        "question": "What is the overall brand positioning of 3Shape?\n",
        "answer": "The overall brand positioning of 3Shape is to focus on totally relevant - difference from mean.",
        "source_doc": "../sources/OMNI_DIGITAL_SPA_19_LAB_.pdf"
    },
    {
        "context": "sirona in the analysis, whose position was in the middle of the map. a bit more scattered the map of the sample made up of dental laboratories. in the analysis on the laboratories, sirona has no central position and its brand image looks not to be related neither to the nearness, nor to the reputation. kavo brand image looks to be almost the same in both analysis, that is, more linked to the nearness and on average with regard to the reputation. other relevant topics worth to be mentioned are the position of dentsply in the analysis on the dental practices, very much related to the nearness, and the position of ivoclar vivadent in the analysis on the laboratories, which seems to be highly related to the reputation, just like zirkonzahn and, to a lesser extent, 3shape. key-stone omnivision digital europe 2015_executive_summary - 29 equipment use and intention to buy the analysis on digital technologies went deeper with the investigation of the main used brands of this segment. in specific, the investigation took into consideration the brands used for scanning and for milling. chart equipment use: scanners - europe the analysis proved that the penetration of this kind equipment varies widely, according to the sample taken into consideration. the sample of dental practices made up of digital technologies users stated to use an intraoral scanner in 20% of the cases, while the corresponding sample of laboratories stated to use a scanner in 84% of the cases. for the former sample, the penetration of dental scanners related to those laboratories having a scanner for either sending outside scan files (in this case, the percentage is 55%) or to be used with an in-lab milling center. chart equipment use: brand numeric distribution, scanners - europe key-stone omnivision digital europe 2015_executive_summary - 30 it is worth to note that only sirona, 3shape and dental wings showed up in both distributions. while",
        "question": "What is the penetration of dental scanners in the sample of dental laboratories?\n",
        "answer": "The penetration of dental scanners in the sample of dental laboratories is 84%.",
        "source_doc": "../sources/OMNI_DIGITAL_EU_15_CLI_LAB_Executive_Summary_.pdf"
    },
    {
        "context": "key-stone omnivision digital europe 2015_executive_summary - 19 the cases, they send the scan files to the manufacturer/milling center channel, in 44% of the cases they also send the scan files to a partner lab, and 11% of them also have an in-lab milling. on the other hand, with regard to the channel users, out of the total partner lab users (blue circled data, respondents sending their models or scan files to a partner lab), 48% of them also send their models or scan files to a manufacturer/milling center and 11% of them also have an in-lab milling. of course, this is a kind of multiple answer question as well. role of digital technologies in the future chart influence of digital technologies on prosthetics performance europe vs. breakdown per country the approach of the laboratories is not very different from that of dental practices, as the majority of the respondents state to believe the digital prosthetics will have a relevant role but the traditional prosthetics will be relevant in the future, too. in specific regard to this statement, the percentage (70%) is higher than that of the dental practices (54%). in comparison to the overall result, clearly, the german market, given its weight, influences the overall results, but it is interesting to note how the most mature market regarding digital technologies, the german one, believe the new technologies will have a relevant role, but the traditional prosthetics will be relevant in the future anyway. in addition, relevant differences in the uk are related to the fact that a higher than average portion of respondents state that the digital technologies will affect only a part of the prosthetics, therefore its role will not be paramount. (15% vs 7% overall). key-stone omnivision digital europe 2015_executive_summary - 20 digital technology acceptance in dental laboratories stance versus digital technologies",
        "question": "What percentage of european partner lab users also send their models or scan files to a manufacturer/milling center?\n",
        "answer": "10-15%",
        "source_doc": "../sources/OMNI_DIGITAL_EU_15_CLI_LAB_Executive_Summary_.pdf"
    },
    {
        "context": "manufacturers - models partner lab - scans partner lab - models manufacturers - scans manufacturers - models production for labs in-house partner-lab manufacturer scans models production for dentists internal production outsourcing 5,5 elements 0,4 elements 1,3 elements (13,1% ) 0,5 elements (5,4% ) 2,7 elements (27,3% ) 0,3 elements (2,9%) 5,1 elementi (51,3%) overall production for dentists: 9,9 elements (100%) labo base: 417 cases (providers of cad-cam elements) cad-cam production share: synthesis trend analysis 120 the differences below +/- 2% should be considered not statistically relevant. to calculate the production share by channel and technology we have to exclude the elements produced in-house for other laboratories, to avoid the double counting of the same elements. according to the statements of the interviewed laboratories (the channel / brand consistency should be verified), the following data processing allows to split the productions as indicated. base: 417 cases (providers of cad-cam elements) the trend analysis highlights an increasing share for the in-house production mostly at the expense of the production made by the partner-labs, undergoing a turnaround since even among the laboratories that outsource production using manufacturers or partner- labs, a greater propensity to send scans emerges compared to the adoption of absolut full outsourcing. labo fixed prosthesis production share integrated processing on dental practices and laboratories percentage of elements clinic+labo the base refers to the whole universe of reference (including those who do not provide patients with prosthesis from digital workflow). 121 overall production share by technology and channel technologies elements made with traditional impressions: 83% elements made with optical impressions: 16% elements made in the practice with chairside system: 7% prosthesis production with digital workflow focus on production technologies labo",
        "question": "What percentage of elements are made with optical impressions in Italy?\n",
        "answer": "16%",
        "source_doc": "../sources/OMNI_DIGITAL_ITA_19_CLI_LAB_INTEGRATED_.pdf"
    },
    {
        "context": "its interesting to note the very good awareness level of bego in germany, along with other local brands. brand positioning brand positioning: overall brands in your opinion, how do the brands that i am going to read out to you rate in the following areas? please rate them with totally irrelevant, partially irrelevant, neutral, quite relevant, totally relevant. 34 base: 617 quotes processing without don't know high reputation received, together with other items, the highest average score. other important items are reliability, trustworthy and innovative. the lowest scores come from affordable, too expensive and good price/quality ratio. as if the image of the brand in the digital world are is not associated with price related topics. note the 5 possible answers have been further clustered in order to better highlight the differences in the scores among the items and the brands evaluated. the clustering is the following: not relevant: the scores grouped in this cluster are totally irrelevant, partially irrelevant, neutral. the other clusters quite relevant and totally relevant are related to the original answers without any grouping. brand positioning: 3shape, sirona-cerec, 3m in your opinion, how do the brands that i am going to read out to you rate in the following areas? please rate them with totally irrelevant, partially irrelevant, neutral, quite relevant, totally relevant. 35 base: 133 quotes 3shape sirona-cerec 3m processing without don't know base: 57 quotes base: 42 quotes brand positioning: zirkonzahn, kavo, bego in your opinion, how do the brands that i am going to read out to you rate in the following areas? please rate them with totally irrelevant, partially irrelevant, neutral, quite relevant, totally relevant. 36 zirkonzahn kavo bego processing without don't know base: 45 quotes base: 30 quotes base: 32 quotes brand positioning: amann girrbach, dental wings, ivoclar vivadent",
        "question": "How does the brand Bego rate in terms of reputation?\n",
        "answer": "The brand Bego scores higher than average in trustworthiness but falls down below the average in affordability.",
        "source_doc": "../sources/OMNI_DIGITAL_EU_15_LAB_.pdf"
    },
    {
        "context": "11,8 33,2% 11,9 38,6% 14,5 51,1% 17,1 51,6% 15,0 51,1% 5,4% ceramic elements on cad-cam milled metal frameworks 12,8 35,7% 11,7 37,8% 8,0 28,4% 7,5 22,5% 7,4 25,2% 2,1% all ceramics 11,1 31,1% 7,3 23,7% 5,8 20,5% 8,6 25,9% 6,9 23,6% 7,4% ceramic elements on pressed frameworks 2,7 7,5% 2,3 7,5% 2,1 7,5% 3,5 10,6% 3,2 10,9% 0,0% ceramic elements on cad-cam milled frameworks 8,4 23,6% 5,0 16,2% 3,7 13,0% 5,1 15,3% 3,7 12,7% 7,4% total (ceramics fixed prosthesis providers) 441 395 415 428 479 composite fixed prosthesis how many composite elements for fixed prosthesis does your lab produce on average in a week? composite production 108 the differences below +/- 2% should be considered not statistically relevant. percentage of laboratories the trend analysis highlights an increase in laboratories that provide composite fixed prosthesis and in their production, which is close to the levels recorded in composite fixed prosthesis trend analysis 2018 2017 2016 2015 2013 2012 18-17 composite fixed prosthesis yes 36% 29% 35% 28% 43% 37% 7,5% no 64% 71% 65% 72% 57% 63% 7,5% total (whole sample) 588 590 584 587 650 648 average number of elements per week composite fixed prosthesis 7,9 7,0 7,1 5,6 6,9 8,4 composite with traditional techniques 4,0 4,0 n.a. n.a. n.a. n.a. composite with cad-cam technique 3,9 3,0 n.a. n.a. n.a. n.a. total (composite fixed prosthesis providers) 214 170 204 161 278 234 labs producing fixed prosthetic elements in composite age of the laboratory owner <=45 (44%) age of the laboratory owner >55 (24%) laboratory opening year (44%) 1 technician (19%) 3 or more technicians (46%) monthly purchases >1000 (44%) composite production share by technique considering all the composite elements for fixed prosthesis produced in your laboratory, please tell us the percentage of them produced with the following techniques. composite production share 109 the differences below +/- 2% should be considered not statistically relevant.",
        "question": "How many composite elements for fixed prosthesis do laboratories produce on average in a week?\n",
        "answer": "Laboratories produces 7.9 composite elements for fixed prosthesis on average in a week.",
        "source_doc": "../sources/OMNI_DIGITAL_SPA_19_LAB_.pdf"
    },
    {
        "context": "elements made with optical impressions: 16% elements made in the practice with chairside system: 7% prosthesis production with digital workflow focus on production technologies labo production share by technology: synthesis taking into considerations all the elements made with cad-cam systems, what percentage do you use the following technologies? production share by technology taking into considerations all the elements made with cad-cam systems, what percentage do you use the following technologies? in-house base: 417 cases (providers of cad-cam elements) percentage of elements labo 123 this information is crucial to calculate the breakdown of the production, because the share of production towards other laboratories must be deducted from the overall production to extrapolate the one related to dentists only. currently, prosthetic laboratories produce internally 53% of all the frameworks through their own milling unit. however, a part of this production is directed to other laboratories (7%): they are supplied with digital prosthesis by equipped laboratories, instead of addressing to a milling center. production share by technology: synthesis taking into considerations all the elements made with cad-cam systems, what percentage do you use the following technologies? production share by technology production sent to dental practices only (production for other laboratories is excluded) percentage of elements trend analysis 2018 % 2017 % 2016 % 2015 % 2013 % 2012 % 18-17 number of cad-cam elements 9,9 100,0% 8,9 100,0% 5,7 100,0% 5,7 100,0% 4,1 100,0% 5,1 100,0% in-house elements (sent to dental practices) 5,1 51,3% 3,4 38,6% 2,0 34,8% 1,9 32,8% 1,0 23,6% 1,1 21,2% 12,7% elements from scans 4,0 40,3% 3,9 43,9% 2,4 42,2% 2,5 44,4% 1,5 37,5% 2,0 38,5% 3,6% elements from scans sent to other laboratories 1,3 13,1% 1,3 14,2% 0,8 14,1% 1,0 17,2% 0,6 14,0% 0,6 11,4% 1,2% elements from scans sent to manufacturers 2,7 27,3% 2,7 29,7% 1,6 28,1%",
        "question": "What percentage of elements made with optical impressions are made in-house in Italy?\n",
        "answer": "The context does not provide an explicit answer to this question.",
        "source_doc": "../sources/OMNI_DIGITAL_ITA_19_CLI_LAB_INTEGRATED_.pdf"
    }
]
